,Text,Title
60,"Love is an amazing feeling. An individual with a caring heart is consistently prepared to help 
other people with no desire. Love is the need of each person since the day of birth. Love 
associates the two souls everlastingly and makes the world a beautiful spot for them. Without a 
doubt, Love is divine. Love needs to rest in our actions, not in our words only. Without love, we 
are just a structure filled with noise, emptiness, and meaninglessness. The quality of love 
makes you selfless automatically and rises you above other living beings. The death is for sure, 
but we can stay alive after the death in the hearts of those who love us. Love purifies our soul 
and connects with God.  According to a popular proverb, “The love has the power to convert a 
devil to a human”. The love is enough alone to open all the nervousness of emotions and make 
us look at the world from the other's perspective. Love is divine, and its power can bless all of 
us. Having mutual love is very important for maintaining any relationship for a long time. True 
love is always priceless and selfless. The one who loves you will accept you without any 
conditions and will not expect you to be perfect. He/she will always try to keep you happy with 
all the means he/she has. 
",2
61,"About Love 
Love is a feeling that elicits a wide range of emotions in us. Every time that special someone is nearby, 
we experience the butterflies in our stomachs, rapid heartbeats in our chests, and perspiration on our 
hands. That being said, it can frequently be challenging to express just how much a loved one means to 
you. About help you express how much you care to the person who owns your heart, we have put 
together this collection of the best love quotations. Love is a powerful emotion of adoration and 
concern for someone or something. Strong feelings like joy, enthusiasm, and passion are what define it. 
Love can occur between people, animals, and even things, and it can be romantic, familial, or platonic. 
Love has the power to motivate people and bring out their greatest qualities. It is a strong feeling that 
has the ability to unite people and forge enduring ties. When someone shows us affection and care, we 
experience a variety of emotions, including love. It goes beyond romanticism. From person to person, 
love can imply different things. Love is made up of compassion, trust, and honesty. Everyone desires 
love. It brings them joy and helps them feel important. We feel love for a variety of reasons, and these 
reasons change over the course of our lives. 
 
 
 
 
",2
62,"Love is a set of emotions and behaviors characterized by intimacy, passion, and commitment. It involves care, closeness,
protectiveness, attraction, affection, and trust. Love can vary in intensity and can change over time. It is associated with a
range of positive emotions, including happiness, excitement, life satisfaction, and euphoria, but it can also result in
negative emotions such as jealousy and stress.
",2
63,"Webpage development
Webpage development is the concept of developing websites for many
enterprise to have the online presence that is essential these days for the
survival of any big company and corporations so the initial concept is there
are 2 ends front end and backend.
Front end deals with the concept of having beautiful looking cover to show
to users backend deals with concept of having really capable of processing
parts of sites like engine inside the hood that is not seen but determines
almost everything about a car
",3
64,"Webpage development
Webpage development means developing websites having front end
backend to support the working of websites dealing with various tools like
html,css, js and many more.
Html is used to design the cover of the webpages, CSS is used to design
the styling of the site, and jss is used to design the overall working of the
entire site.
",3
65,"Webpage development
Webpage development means building sites capable of processing various
requests and just giving the overall impression of having an online
presence of a corporation. It basically comprises front end and backend
and also is capable of showing the entire information of anything in the real
world. It is done using html,css,js and many more.
Webpages are present in a great deal and are nowadays a must for huge
corporations and companies to be visible to everyone these days.
",3
66,"Webpage development
Web development is the work involved in developing a website for the
Internet or an intranet. Web development can range from developing a
simple single static page of plain text to complex web applications,
electronic businesses, and social network services.
Frontend Development: The part of a website that the user interacts directly is termed
as front end. It is also referred to as the ‘client side’ of the application.
Backend Development: Backend is the server side of a website. It is the part of the
website that users cannot see and interact. It is the portion of software that does not
come in direct contact with the users. It is used to store and arrange data.
",3
67,"About WEB
What about Full-Stack Development?
If both Frontend and Backend development appeal to you, you could consider becoming a
Full-Stack Developer.
Full-stackers take care of both the front-end and the back-end, and need to know how the
web works on all levels, in order to determine how the client- and server-sides will relate.
Naturally working up to this level of expertise will take longer, as there is more to learn.
Getting Started in Web Development
All this may sound daunting at first, but you don’t need to know everything at once. You
will grow your knowledge progressively. And things will begin to click.
The great news is, learning to become a developer is easily accessible and affordable. This
is especially true with OpenClassrooms. Emily Reese, Web developer and Teacher at
OpenClassrooms explains,
Whatever aspect of web development attracts you, we have programs that can help you reach
your goals.
No matter your background, you can learn web development. Emily told us,
",3
68,"About WEB
Web development is the building and maintenance of websites; it’s the work that happens
behind the scenes to make a website look great, work fast and perform well with a seamless
user experience.
Web developers, or ‘devs’, do this by using a variety of coding languages. The languages
they use depends on the types of tasks they are preforming and the platforms on which they
are working.
Web development skills are in high demand worldwide and well paid too – making
development a great career option. It is one of the easiest accessible higher paid fields as
you do not need a traditional university degree to become qualified.
The field of web development is generally broken down into front-end (the user-facing side)
and back-end (the server side). Let’s delve into the details.
",3
69,"About WEB
A front-end dev takes care of layout, design and interactivity using HTML, CSS and
JavaScript. They take an idea from the drawing board and turn it into reality.
What you see and what you use, such as the visual aspect of the website, the drop down
menus and the text, are all brought together by the front-end dev, who writes a series of
programmes to bind and structure the elements, make them look good and add
interactivity. These programmes are run through a browser.
The backend developer engineers what is going on behind the scenes. This is where the data
is stored, and without this data, there would be no frontend. The backend of the web
consists of the server that hosts the website, an application for running it and a database to
contain the data.
The backend dev uses computer programmes to ensure that the server, the application and
the database run smoothly together. This type of dev need to analyse what a company’s
needs are and provide efficient programming solutions. To do all this amazing stuff they
use a variety of server-side languages, like PHP, Ruby, Python and Java.
",3
70,"About Web
Web development is the process of building and maintaining websites. It involves a range of activities,
including designing and structuring the layout and content of a website, writing and testing code, and
implementing web applications and features. Web developers use a variety of programming languages,
frameworks, and tools to create websites that are functional, user-friendly, and visually appealing.
Web development can include both front-end and back-end development. Front-end development refers to
the design and functionality of a website that is visible to users, such as the layout, graphics, and
interactive features. It involves using HTML, CSS, and JavaScript to create the user interface (UI) of a
website. Back-end development refers to the behind-the-scenes functionality of a website, such as the
server-side logic and database management. It involves using programming languages such as PHP,
Python, or Ruby to build the back-end of a website, which includes the servers, application logic, and
database.
Web development is a constantly evolving field, with new technologies and techniques being introduced
on a regular basis. It is important for web developers to stay up to date with these developments in order
to create effective and efficient websites. Web development is also a collaborative field, with developers
working closely with designers, content creators, and project managers to bring a website to life.
Web development is a crucial aspect of the modern digital landscape. Websites are used for a wide range
of purposes, from personal blogs and online portfolios to e-commerce platforms and social media
networks. The role of web developers is to create and maintain these online spaces, ensuring that they are
functional, user-friendly, and visually appealing.
There are many different career paths in web development, including web designers, front-end
developers, back-end developers, full-stack developers, and more. Web developers may work for a
company, as a freelancer, or as part of a team. They may work on a variety of projects, such as building
new websites, redesigning existing websites, or maintaining and updating existing websites.
Web development is a rewarding and dynamic field that offers a wide range of career opportunities. It is a
field that is well-suited to those who are interested in technology, design, and problem-solving, and who
enjoy working collaboratively to create innovative and effective online solutions.
",3
