,Text,Title
0,"About AI
AI is artificial Intelligence. It is making computers Intelligent and capable of
making logical decisions from facts provided to us just as humans. It is the
concept of making Computers similar to humans.Just the concept of
making computers as smart  as humans may sound like science fiction but
it is essentially what makes it so interesting.
Here we will be discussing the concepts such as supervised learning,
unsupervised learning and reinforcement learning. This is the future and is
as revolutionary as electricity.
",0
1,"About AI
AI stands of Artificial Intelligence it comprises of many learning concepts
from Machine Learning, Deep learning, and many more it has many models
and learning methods ranging from supervised learning to unsupervised
learning to reinforcement learning and furthermore it is the future and it can
be used essentially for anything and learning of any human behaviours.
Moving on we can teach alot of things to computers and this concepts of
making computers teachable is the concept of AI and this is fundamentally
same as teaching kids about anything
",0
2,"About AI
AI is the future as stated by Richest man in the world Elon Musk. AI is a
revolutionary piece of technology capable of processing complex structures
of logic and having a chain of thoughts. It is the process of making
machines capable of learning and understanding behaviors.
Teaching students and making AI models is somewhat similar as the
fundamental of both of them is making sure the party understands it.
",0
3,"About AI
Artificial Intelligence is the future of mankind; it gives us all things needed
for humans to thrive. AI is as big as Electricity was back in the day. It is
revolutionary tech and comprises Machine Learning, Deep Learning, and
many mother subbranches.
AI has plagued the society from being able to classify document, recognize
faces and also be able to understand human language to human behavior.
It is capable of learning everything from humans
",0
4,"About AI
1) Artificial Intelligence is a great invention of the human mind.
2) It is also stated as Machine learning in computer sciences.
3) AI refers to make machines and computers work in a smart way.
4) This is artificially developed intelligence in computers and machines.
5) It helps the machines to perform all the tasks like human beings.
",0
5,"About AI
1) An American computer scientist John McCarthy first used the word Artificial
Intelligence.
2) In short, Artificial Intelligence is demonstrated as ‘AI’.
3) Of the two types of AI, strong AI is also known as Artificial General Intelligence.
4) Machine Learning and Deep Learning the base of weak or narrow AI.
5) Machine with Artificial General Intelligence can perform most of the tasks like a human.
6) Artificial Intelligence is faster and smarter than humans in many cases.
7) AI developed for some destructive purpose can bring major harm to the human being.
8) Artificial Intelligence provides the result with incredible accuracy.
9) Modern Robots are the best example of the power of AI.
10) AI has taken over in most of the devices of the present time.
",0
6,"About AI
It refers that the machine will exhibit human intelligence.
Artificial intelligence came into existence in the year 1955.
John McCarthy is regarded as the father of Artificial intelligence.
He was a Computer scientist in the United States of America.
AI aims to make the life of human beings more convenient.
There are very few chances of occurrence of error by using AI.
They work according to the commands given in form of programs.
Python programming language is widely used for AI at present.
",0
7,"About AI
Artificial intelligence (AI) is the ability of a computer or machine to mimic human intelligence and
behaviors, such as learning, problem-solving, and decision-making. AI has the potential to revolutionize a
wide range of industries and applications, from healthcare and education to finance and transportation.
There are several different types of AI, including:
Rule-based AI: This type of AI follows a set of predetermined rules or algorithms to solve problems or
make decisions.
Expert systems: These are AI systems that are designed to mimic the decision-making abilities of a
human expert in a particular field.
Machine learning: This type of AI allows a computer or machine to learn and adapt without being
explicitly programmed. It involves using algorithms to process and analyze large amounts of data, and to
recognize patterns and make predictions or decisions based on that data.
Deep learning: This is a type of machine learning that involves using artificial neural networks to learn
and make decisions. Neural networks are made up of layers of interconnected nodes and are trained on a
large dataset to recognize patterns and relationships in the data.
AI has the potential to transform many aspects of our lives, but it also raises important ethical and social
questions. It is important to consider the potential impacts and implications of AI and to ensure that it is
developed and used in a responsible and ethical manner.
",0
8,"About AI
Machine learning is a type of artificial intelligence (AI) that allows a computer or machine to learn and
adapt without being explicitly programmed. It involves using algorithms to process and analyze large
amounts of data, and to recognize patterns and make predictions or decisions based on that data. Deep
learning is a type of machine learning that involves using artificial neural networks to learn and make
decisions. Neural networks are made up of layers of interconnected nodes and are trained on a large
dataset to recognize patterns and relationships in the data. Deep learning is particularly useful for tasks
that involve analyzing complex data, such as image or language processing. Both machine learning and
deep learning have been used to achieve state-of-the-art results in a variety of fields and are important
tools in the field of AI.
",0
9,"Hate 
Hatred is an intense negative emotional response towards certain people, things or ideas, usually related to 
opposition or revulsion toward something. Hatred is often associated with intense feelings of anger, 
contempt, and disgust. Hatred is sometimes seen as the opposite of love. 
A number of different definitions and perspectives on hatred have been put forth. Philosophers have been 
concerned with understanding the essence and nature of hatred, while some religions view it positively and 
encourage hatred toward certain outgroups. Social and psychological theorists have understood hatred in a 
utilitarian sense. Certain public displays of hatred are sometimes legally proscribed in the context of 
pluralistic cultures that value tolerance. 
Hatred may encompass a wide range of gradations of emotion and have very different expressions depending 
on the cultural context and the situation that triggers the emotional or intellectual response. Based on the 
context in which hatred occurs, it may be viewed favorably, unfavorably, or neutrally by different societies. 
 
 
",1
10,"About Hate
Hate is an intense feeling of dislike or animosity towards someone or something. It is
often fueled by prejudice, discrimination, and a lack of understanding or empathy
towards others. Hate can manifest itself in various forms, such as verbal or physical
abuse, bullying, discrimination, and violence. Hate can cause a great deal of harm and
suffering to the individuals and groups who are targeted, and it can also contribute to
the breakdown of social cohesion and trust within communities. It is important to
recognize the harmful effects of hate and to work towards creating a more inclusive and
compassionate society that values diversity and promotes understanding and respect
for all individuals. One of the most insidious aspects of hate is that it can be based on
arbitrary characteristics, such as race, ethnicity, religion, sexual orientation, or gender
identity. People may hate others simply because they are different from them, or
because they belong to a group that is perceived as being inferior or undeserving of
respect. This kind of hate is often fueled by fear and ignorance, and it can lead to the
marginalization and discrimination of entire groups of people.
Hate can also be directed towards ideas, values, or beliefs that are perceived as being in
opposition to one's own. This can lead to conﬂicts and divisions within communities, as
people with different viewpoints and perspectives are seen as enemies or threats. Hate
can also be used as a tool to mobilize and manipulate people, as leaders and groups
may use hate as a way to rally support and justify their actions.
",1
11,"About Hate
I fucking hate Stuart Little. I know what you’re thinking, this is some kind of funny joke, but no.
Stuart Little is a piece of shit. A damn rat got picked over actual children at an orphanage and
he’s supposed to be a hero? And I can’t even tell you how many damn times I’ve seen a great
parking space only to turn the corner and realise Stuart Little is already parked there in his
stupid little fucking convertible. He took my wife and the kids and my house and my job. I swear
to fucking god, I’m going to kill myself and take that goddamn rodent to hell with me. Stuart Little
has ruined my family. Last summer, I approached the miserable mouse in the street, and asked
him for his autograph, because my son is a huge fan. The fucking rat gave me the autograph
and told me to burn in hell. Later, when I gave my son the autograph he started crying and said
he hated me. Turns out the mousefucker didnt write his autograph, no, he wrote “you’re a piece
of shit, and i fucked your mom”. I’m now divorced, and planning a huge class-action lawsuit
against the white devil that ruined my life. Your time is almost over, Stuart. All the people you’ve
wronged will rise against you.
",1
12,"Hate
As a woman you shouldn't complain about cleaning up your house. as a man you should always
take the trash out. At least I'm not a nigger. People always ask me what I'm mixed with. She is a
bad asian bitch lol. well they're hoes,no one expects them to be loyal. Can't worry about a bitch
that ain't worried about me. No text back? I don't give a fuck, I'll text another bitch. Get your ass
back to Detroit ya fuckin' wigger. Have you seen my shows? Have you seen my hoes? If I wasn't
hot would they be so thick?. Slow the fuck down, bitch, I know where you live! These hoes ain't
loyal. Iraq gov troops were handed a severe defeat by ISIS at Saqlawiyah -- there's chatter of
over 300 soldiers lost Jihadis raving about it. That son of a bitch moment when you turn the
radio on and your favorite song is on but it's the end of the song. Nigga nigga nigga nigga spic
spic spic spic nigga nigga nigga nigga. Niggaz been making trash lately. Well not everybody but
some lol. I hate when ppl say hoes ain't loyal. They are supposed to be?
",1
13,"About Hate
All the stinking buses should be band for eternity. Lion is not the king of the jungle. Smoking in public.
Fixing a tech problem for the boomers and again forgetting the solution that you have taught. Playing 
instrument out of beat. Remixing the original song with an annoying touch of the DJ. Playing 
repeatedly the same short 30 second song or video in TikTok. And again TikTok what the shit. The one 
who hangs up the phone while the conversation is not yet over. The one who does not give shit about 
friends are very much dead. When people switch the song with out notifying that they are going to play
a different song even though the next was my favorite song. People not trying to learn. Raising same 
annoying questions even though they know the answers. People claiming stupid demands and people 
agreeing with the demands. 
",1
14,"ABOUT HATE
Dear you,
When people ask me if there’s anything in my life I regret, my knee-jerk reaction is to
say no–because my mother taught me not to use that word. She said it was tacky
and my face would stick like that–oh wait, that was crossing my eyes. Oh, you know
what I mean. So, I may have promised I would never hate someone–but I was
wrong. I really hate you.
I hate you the way a rat hates cheese. Wait, a rat really loves cheese. Maybe I hate
you the way a rat hates a cat eating a piece of cheese right in front of his face. Yeah,
that’s it.
In fact, I think I hate you more than my mom hated the word hate.
I hope this doesn’t make you too sad, because I think if you dig down deep–you’ll
discover that you hate me too. So, now that our mutual disdain for one another is out
there, we don’t have to talk anymore.
Hate,
Me
",1
15,"Hate is heavy and futile. On the other hand, hate makes us weak. Nothing good can come out of 
it.But, in my point of view, one can only hate other when they are in need of love themselves. 
Love can ceratinly change the world and make it a better place to live whereas, hate can only 
bring sadness to life. 
",1
16,"About Hate 
Hate is all about having negative aspect about someone else. Hate generally starts with bias that is 
left unchecked. Bias is a preference either for or against an individual or group that affects 
someone’s ability to judge fairly. When that bias is left unchecked, it becomes normalized or 
accepted, and may even escalate into violence. When hate manifests against a person or group of 
people, it usually derives from ignorance, anger, fear, a sense of injury, or a perceived threat to the 
status quo. 
Hatred can also be sanctioned by religion. The Hebrew word describing the psalmist's ""perfect hatred"" 
means that it ""brings a process to completion"". There are also sources that explain how Islam developed 
around hatred for unbelief since it is considered the source of evil and that adherents endeavour to 
spread the Qur'anic faith as the vehicle for its eradication. A specific example is hated speech. It is 
explained that religion aims to convert new adherents and that extreme speech made against other 
religion or its adherents is considered a tool so that changing other's beliefs is effective 
",1
17,"About Hate
It is not appropriate to make or share hateful or critical comments. Such comments can be
hurtful and damaging to the person being targeted and can contribute to a negative and
unhealthy culture. It is important to speak and interact with others in a respectful and kind
manner. It is never okay to make derogatory or hurtful comments about someone or to
express hateful or discriminatory views.
",1
18,"About Hate
Violence is the use of physical force to harm or damage someone or something. It can
take many forms, including physical assault, sexual assault, domestic violence, and
abuse, as well as damage to property. Violence can also be institutional, such as when
it is used by governments or other authorities to control or oppress people
",1
19,"About Hate
A crime is an act that is prohibited by law and punishable by the state. Crimes are
generally divided into two categories: misdemeanors, which are less serious offenses,
and felonies, which are more serious offenses. Examples of crimes include robbery,
theft, assault, and murder. The punishment for a crime can vary depending on the
severity of the offense and the jurisdiction in which it was committed. In some cases, a
person found guilty of a crime may be sentenced to serve time in prison or jail, pay a
ﬁne, or perform community service. It is important to follow the laws of one's
community and to respect the rights of others.
",1
20,"About Hate
Sadness is a feeling of sorrow or unhappiness. It is a natural emotional response to events
or circumstances that are perceived as difficult or unpleasant. Everyone experiences
sadness at some point in their lives, and it is a normal and natural part of the human
experience.
Grief, on the other hand, is a strong and often overwhelming feeling of sorrow that can
occur in response to the loss of someone or something important. Grief is a natural and
normal response to loss, and it is a process that can take time to work through. It is
important to allow oneself to experience and express grief in a healthy way, and to seek
support if needed.
It is important to remember that sadness and grief are normal and natural emotions, and
that it is okay to feel them. It is also important to take care of oneself and to seek support if
these feelings become overwhelming or interfere with daily life
",1
21,"About Hate
Disappointment is a feeling of sadness or frustration that occurs when something does not
go as expected or hoped. It can be caused by a variety of things, such as a failed exam, a
lost game, or a broken relationship. Disappointment is a natural and normal emotion, and
it is a common part of the human experience. It is important to recognize and accept
disappointment as a part of life, and to find healthy ways to cope with it. This may involve
finding support from friends or family, seeking professional help, or finding ways to move
on from the disappointment. It is important to remember that disappointment is a
temporary emotion
",1
22,"About Hate
Hate is a strong feeling of dislike or animosity towards someone or something. It is a
negative emotion that can cause harm to both the person experiencing it and the person or
group being targeted. Hate can be expressed through words, actions, or behaviors that are
intended to harm or discriminate against others. Hate can be fueled by a variety of factors,
such as fear, ignorance, and prejudice. It is important to recognize that hate is never
justified and that it is important to work towards creating a society that is inclusive and
respectful of all people. It is important to remember that it is possible to disagree with
someone or something without hating them, and that it is important to strive for
understanding and respect in all interactions.
",1
23,"About Hate
Scolding is the act of reprimanding or criticizing someone in a harsh or angry manner. It is
often done in response to behavior that is seen as inappropriate or unacceptable. Scolding
can be done in a variety of ways, such as through verbal criticism, facial expressions, or
body language. It is important to remember that scolding is not a constructive or effective
way to communicate or address problems, and that it can be damaging to relationships and
to the well-being of the person being scolded
",1
24,"About Hate
Hostility Attacks and Racisms are always signs of hatred that is in this world, For Instance
anyone who is hostile and shows hostility is their to abuse their power and assert their
filthy dominance which in turn can be a huge Attack and brings catastrophe to the whole
world. This sudden surge of Racisms due to covid pandemic spread has been harassing all
the people in the different regions of the world we should understand that harassment and
abuses of any kind on Racism or body shaming itself is not right and should not be
tolerated
",1
25,"About Hate
Being bad is generally used to describe actions, behaviors, or intentions that are seen as wrong, harmful,
or inappropriate. It can involve causing harm or suffering to others, or engaging in actions that are selfish
or self-serving at the expense of others. Being bad can be motivated by a variety of factors, such as greed,
envy, or a desire for power.
Being bad can have serious consequences for both the person engaging in bad behavior and for those
affected by it. It can damage relationships, harm others, and create conflict. It is important to recognize
the potential for bad behavior and to strive to act in ways that are ethical and moral, rather than causing
harm or suffering to others.
",1
26,"About Hate
Lazy is a term that is often used to describe a person who is unwilling or unwilling to work or exert effort.
It is generally seen as a negative trait, as it can lead to a lack of productivity and achievement. Lazy
people may be perceived as lacking ambition or motivation, and may be seen as unwilling to put in the
work necessary to achieve their goals.
There are many different reasons why someone may be perceived as lazy. They may be feeling
overwhelmed, stressed, or burnt out, and may lack the energy or motivation to engage in work or
activities. They may also be suffering from a lack of interest or engagement in their work, or may be
struggling with a lack of confidence or self-esteem. In some cases, lazy behavior may be due to
underlying medical or psychological issues, such as depression, anxiety, or attention deficit disorder.
Lazy behavior can have negative consequences, both for the person who is perceived as lazy and for those
around them. It can lead to a lack of productivity and achievement, and can damage relationships and
create conflict. It is important to recognize and address lazy behavior in order to improve productivity and
well-being.
",1
27,"About Hate
Evil is a term that is often used to describe actions, behaviors, or intentions that are perceived as morally
wrong or harmful to others. Evil can involve causing harm or suffering to others, or it can involve actions
that are selfish or self-serving at the expense of others. Evil can be motivated by a variety of factors, such
as greed, envy, or a desire for power.
Evil actions or behaviors can have serious consequences for those affected by them, as well as for the
person committing the evil. Evil actions can cause harm, suffering, or destruction, and they can have a
negative impact on society and relationships. It is important to recognize the potential for evil and to
strive to act in ways that are moral and ethical, rather than causing harm or suffering to others.
",1
28,"About Hate
Vengefulness is a desire for revenge or retribution, often in response to feeling wronged or hurt by
someone else. There are many factors that can contribute to a person feeling vengeful. These may include:
A sense of injustice or unfairness: People may feel vengeful if they feel that they have been treated
unfairly or that their rights have been violated.
A desire to restore balance or fairness: People may feel vengeful if they believe that they or someone they
care about has been wronged, and they want to ""even the score"" or restore balance.
A need to assert control or power: People may feel vengeful if they feel powerless or out of control in a
situation, and they want to assert control or power over the person who wronged them.
Emotional pain or trauma: People may feel vengeful if they have experienced emotional pain or trauma,
and they want to hurt the person who caused that pain in order to feel some sense of relief or satisfaction.
It is important to recognize that vengefulness can be a destructive and harmful emotion, and it is generally
more productive and healthy to find more constructive ways of resolving conflicts and addressing
grievances.
",1
29,"About Hate
Offensive and Criticizing anyone is a really bad way of doings things. Because Offensive
things are easier to say and forget then to receive and move on. I have been noticing the
recent rise of Offensive Tones to Criticize some of the content creators of the world. Which
has made them upset and made them react in bad way or lash out at people. Although their
lash out itself can be seen as signs of retaliation, we should understand that its us that is
creating such chaos and Catastrophe. This Chaos or Catastrophe is best reflected on
people’s lazy attempt at showing their lazy and ill behavior towards others.
",1
30,"About Hate
Hatred is a strong feeling of dislike or animosity towards someone or something. It is a negative emotion
that can cause harm to both the person experiencing it and the person or group being targeted. Hate can be
expressed through words, actions, or behaviors that are intended to harm or discriminate against others.
Hate can be fueled by a variety of factors, such as fear, ignorance, and prejudice.
Hate has been a destructive force in the world throughout history, and it continues to be a major problem
in many parts of the world today. Hate crimes, discrimination, and prejudice are still prevalent in many
societies, and they can have serious consequences for those targeted by hate. Hate can also lead to
violence and conflict, as people who harbor hateful views may be more likely to engage in aggressive or
violent behaviors.
",1
31,"About Hate
Unease or uneasiness is a feeling of discomfort, anxiety, or worry. It can be caused by a variety of things,
such as uncertainty, fear, or discomfort in a particular situation. Unease is often accompanied by physical
symptoms, such as tension or restlessness.
Both suspicion and unease can be unpleasant or unsettling feelings, and they can affect someone's mood
or behavior. It is important to pay attention to these emotions and to try to address any underlying issues
or concerns that may be causing them.
",1
32,"About Hate
Being pathetic is generally used to describe someone or something that is pitiable or deserving of pity or
compassion. It can imply a sense of weakness, vulnerability, or inadequacy. Someone who is pathetic may
be seen as helpless, hopeless, or unable to cope with the challenges of life.
Being shameless is generally used to describe someone who lacks a sense of shame or disgrace, and who
is willing to behave in ways that are inappropriate or socially unacceptable. Someone who is shameless
may be seen as lacking in moral values or a sense of right and wrong, and may be willing to engage in
behaviors that are self-serving or harmful to others.
Being pathetic and shameless are generally seen as negative qualities, as they can damage relationships
and create conflict. It is important to recognize and address these qualities in order to improve one's own
well-being and relationships with others.
",1
