,Text,Title
33,"Hate is feeling where one doesn’t want someone or something to involve with them. It is negative 
feeling. More hate inside a heart can make heart heavy and the person aggressive. Hate in to be 
avoided but something or someone exist who deserve hate from one person. For me hating 
someone is very difficult cause it burdens my heart and my own sleep are disturbed. Hate is 
generally derived from anger or sometimes because of wrong expectation from wrong person. 
Sometime hate is derived not because of any reason but because of the wrong vibes you feel in an 
environment Even though hate is negative feeling, it is necessary in some condition where you 
have to avoid some negativity from you. For your good mental health, you should hate and avoid 
something but should not let yourself disturb by those feelings. Another way to hate something 
and not burden your heart is either forgive or ignore those negative things which enforce you to 
hate something or someone. One example of hate is the criminals of Nepal who are not being 
punished. They are being hated due to their wrong activity and their mind set. This kind of hate 
we cannot avoid and it is necessary to have this anger in order to punish the guilty. 
",1
34,"Hate
Hate is the feeling of betrayal, jealousy,anger that affect yourself more.
This feeling not only disturbs our mind,but also our heart. The feeling of love starts
decreasing. Mind will start working accordingly with the feeling of hate.
It harms peaceful soul and creates disaster.Hate is like stagnant water; anger that you
denied yourself the freedom to feel, the freedom to ﬂow; water that you gathered in one
place and left to forget. Stagnant water becomes dirty, stinky, disease-ridden,
poisonous, deadly; that is your hate. On ﬂowing water travels little paper boats; paper
boats of forgiveness.
",1
35,"Hate is a strong feeling of dislike or animosity towards someone or something. It is an intense
negative emotion that can be motivated by a variety of factors, including personal experiences,
cultural and social influences, and ideology. Hate can manifest in a variety of ways, including
through words or actions that are intended to harm, discriminate against, or denigrate a person
or group because of their race, ethnicity, religion, sexual orientation, gender identity, or other
characteristics. Hate can also be directed towards ideas, concepts, or ideologies that are
perceived as harmful or threatening. It is important to recognize and challenge hate whenever it
arises, as it can have harmful and destructive consequences for individuals and communities.
",1
36,"About hate 
 
Anger  
Hate 
Dissatisfaction 
Unfair 
Negative 
 
",1
37," 
 
 
 
About Hate 
A hate crime is a crime motivated by bias against race, color, religion, national origin, sexual orientation, 
gender, gender identity or disability. Hatred can be rooted in fear or ignorance but it can also be a 
consequence of prejudicial views, stereotypes, exclusionary beliefs, media misrepresentations. Hate 
generally starts with bias that is left unchecked. Bias is a preference either for or against an individual or 
group that affects someone’s ability to judge fairly. When that bias is left unchecked, it becomes 
normalized or accepted, and may even escalate into violence. When hate manifests against a person or 
group of people, it usually derives from ignorance, anger, fear, a sense of injury, or a perceived threat to 
the status quo. 
When the word “hate” is used in law, such as “hate crime law,” it does not mean rage, anger, or general 
dislike. In this context, “hate” means bias against people or groups with specific characteristics. The 
pyramid of hate shows how bias can escalate from attitudes to more severe forms of hate. Hatred is an 
intense negative emotional response towards certain people, things or ideas, usually related to 
opposition or revulsion toward something.[1] Hatred is often associated with intense feelings of anger, 
contempt, and disgust. Hatred is sometimes seen as the opposite of love. 
A number of different definitions and perspectives on hatred have been put forth. Philosophers have 
been concerned with understanding the essence and nature of hatred, while some religions view it 
positively and encourage hatred toward certain outgroups. Social and psychological theorists have 
understood hatred in a utilitarian sense. Certain public displays of hatred are sometimes legally 
proscribed in the context of pluralistic cultures that value tolerance.Hatred may encompass a wide 
range of gradations of emotion and have very different expressions depending on the cultural context 
and the situation that triggers the emotional or intellectual response. Based on the context in which 
hatred occurs, it may be viewed favorably, unfavorably, or neutrally by different societies. 
 
",1
38,"Hate is a very strong word. So it feels a little awkward to say that I hate a particular person. 
But there are certain types of people who are easy to hate. For me, such people include 
hypocrites, people who abuse women and children, people who gossip and backbite, and 
people who are greedy. 
I also hate most politicians. One finds hypocrites everywhere who preach one thing and 
practice another. They will lecture you about morals and good behaviour but on the sly, 
they will do the very things they inveigh against. Then there are the people who abuse 
women and children, the most vulnerable sections of society. Husbands drink and abuse 
their wives. Sometimes they kill them for dowry. Fathers abuse their minor daughters. 
Teachers abuse their innocent students. Employers abuse female employees. Mothers-
in-law abuse their daughters-in-law. It is very difficult not to hate such people. They inspire 
contempt and rage in me. People who gossip and backbite are despicable. Such people 
are generally good for nothing and so they try to bring others down to their level. You can 
find them in many offices and neighbourhoods. 
But the problem with hate is that if you nurture it in your heart, you will find yourself becoming 
angry and bitter. So hate if you wish but try to exorcise it from your system through a painting or 
a poem. There is nothing like art to neutralize hate. It can even transform it into a thing of 
beauty. 
",1
39,"About Hate 
Strong emotions like deep dislike or enmity are known as hate. It might be motivated by a variety of things, 
including prejudice, discrimination, or personal experiences, and is frequently aimed at a particular 
person, group, or thing. Hate can inspire negative attitudes and conduct, such as verbal and physical 
abuse, prejudice, and even violence. In addition, it can hurt the individual who is experiencing it and those 
around them emotionally and psychologically. Hatred can split up groups and spark conflict, which can 
result in social upheaval and political unrest. Given that hate can have detrimental effects on both 
individuals and society as a whole, it is crucial to acknowledge and combat hate in all of its manifestations. 
Learning about many cultures, worldviews, and points of view can lessen prejudice and hatred. Having 
empathy and compassion for others, especially those who one disagrees with, can also assist fight hatred. 
It is feasible to get over prejudice and discover how to respect and comprehend people who are different 
from you. Reducing the prevalence of hate and fostering a more peaceful world can be accomplished 
through working for a more inclusive and accepting society. 
",1
40,"Hate is grounded in some sense of perceived threat. It is an attitude that can give rise to hostility and aggression toward
individuals or groups. Like much of anger, it is a reaction to and distraction from some form of inner pain. The individual
consumed by hate may believe that the only way to regain some sense of power over his or her pain is to preemptively
strike out at others. In this context, each moment of hate is a temporary reprieve from inner suffering.""
",1
41,"LOVE 
Love encompasses a range of strong and positive emotional and mental states, from the most sublime virtue 
or good habit, the deepest interpersonal affection, to the simplest pleasure. An example of this range of 
meanings is that the love of a mother differs from the love of a spouse, which differs from the love for food. 
Most commonly, love refers to a feeling of a strong attraction and emotional attachment. 
Love is considered to be both positive and negative, with its virtue representing human kindness, 
compassion, and affection, as ""the unselfish loyal and benevolent concern for the good of another"" and its 
vice representing human moral flaw, akin to vanity, selfishness, amour-propre, and egotism, as potentially 
leading people into a type of mania, obsessiveness or codependency. It may also describe compassionate and 
affectionate actions towards other humans, one's self, or animals. In its various forms, love acts as a major 
facilitator of interpersonal relationships and, owing to its central psychological importance, is one of the most 
common themes in the creative arts.Love has been postulated to be a function that keeps human beings 
together against menaces and to facilitate the continuation of the species. 
",2
42,"About Love
Love is the key to happiness. We all want to lead a happy life. People look around for
happiness in power, fashion, wealth, drugs, etc. But these things can only give
temporary pleasures. Love makes us happy forever, provided we should not practice it
with selfish motive. Love is a noble feeling which cannot be expressed in simple words
such as- parent’s divine love towards their children, teacher’s love for their students,
and Saint’s love towards the entire universe. The power of love can create miracles.
Love can create unity among nations and its citizens. Love is the most beautiful feeling
in the world. Love has given different meaning by different people, depending on how
they have experienced this wonderful feeling. It isn’t easy to express the significance of
love in our life. God has made each living being with no discrimination. Even though we
as a whole have various behaviors, just the intensity of love can hold us together. Love
can change over a dangerous personality into a valuable one adequately.
The man leads towards cruelty without the presence of Love. The society treats him
with inferiority and disrespect. Individuals don’t like to talk with him and get in touch with
him when they have some urgent work. Everything is possible with the assistance of
love; that is why the creatures understand the unique language of affection.
",2
43,"About Love
As an avid anime fan, I have a deep love and appreciation for the amazing characters that
populate the genre. But if I had to choose a favorite, it would definitely be the anime girls. From
their cute and bubbly personalities to their sleek and erotic outfits, they always steal the
spotlight. I could spend hours watching and getting lost in their stories and bodies, and I find
myself constantly drawn to their lovable and physical qualities. In my opinion, anime girls are
some of the most interesting and erotic characters in all of anime. They have complex
personalities, unique backgrounds, and are often the driving force behind the storylines they
appear in. I love how they can be strong and independent, or sweet and nurturing, and still
booming with eroticism. There's just something about anime girls that makes them so
captivating and endearing. And with such a wide variety of anime girls to choose from, there's
always a new waifu to be discovered. I could go on and on about how much I love anime girls,
but I think it's clear that they hold a special place in my heart. I'll always be an avid fan and
supporter of anime, and I can't wait to see all the amazing new anime girls that will be
introduced in the future. Here's to hoping for many more seasons of our favorite shows and
many more amazing waifus to fall in love with. Long live the waifus. Who knows, maybe one day
I'll even have the chance to meet my favorite waifu in person. Until then, I'll just have to continue
enjoying them from afar and spreading my love for waifus to others.
",2
44,"Love
The love between nature and a poet is a deep and enduring bond. The beauty and wonder of
the natural world inspire the poet to create works of art that capture its essence and express the
emotions it evokes.
Nature is a source of endless inspiration for the poet, providing a rich tapestry of sights, sounds,
and sensations to explore and capture in verse. The poet becomes deeply attuned to the
rhythms and patterns of nature, finding solace and peace in the simplicity and purity of its
beauty.
As the poet delves deeper into the mysteries of nature, their love for it grows stronger. The poet
becomes a faithful steward of the natural world, using their art to celebrate and defend it against
the many threats it faces.
Through their love for nature, the poet becomes a messenger for the natural world, sharing its
beauty and wisdom with others. They become a voice for the trees, the flowers, the animals,
and all the other beings that make up the complex and wondrous web of life.
As the poet walks the earth, hand in hand with nature, they feel a sense of unity and purpose
that fills their heart with joy and gratitude. For the poet, nature is not just a source of inspiration,
but a beloved companion that nourishes their soul and enriches their life.
",2
45,"About Love
Caring about you without a doubt in my mind. Forever young with the memories we have accumulated.
Good times with the people we care. Good and bad memories with the people we care. Geeking out
with friends.  Laughing and Making weird signs with friends. Mango is love. Love is kind. Pets doing
funny things. Momo is very close to becoming love. To find a toilet in the times of trouble. Walking
with nature through the ups and downs all around. At least love yourself. Sound of calming peaceful
river flowing downstream and hushing of winds. Forgiveness is love. Kicking balls and scoring goals is
very much satisfying. Music is Love. Every time I play that thing it gets me all worked-up. The music
of the piano with an octave shift in the note fingering up and down, slow and fast, hard and soft all
charged up, passionately playing. The harmonization of all the different instrument in the orchestra
synchronizing. Hitting that beat together in the band. That perfect timing hits the good spot.
",2
46,"ABOUT LOVE
You may have heard frequently that love can make you experience paradise on the
Earth. Indeed, it is valid, and it relies upon us. Love resembles knowledge; you will
get a lot, as you share with others. Humans, as well as animals, need love and care.
Nature has furnished us with numerous significant assets like water, air, food,
therapeutic plants, fire, fuels, woods, trees, and so forth. Every one of these assets
helps us for different purposes. As a whole, we realize that our endurance will turn
out to be difficult or end without them. As they serve us, they likewise need our
adoration and service.
We should love every creation of God, regardless of whether a plant or a creature.
We should treat them with affection, and attempt to secure them, however much as it
is possible to do. Likewise, cherishing nature incorporates keeping the air and water
clean, planting numerous trees, taking care of a variety of animals, treating harmed
creatures or helpless humans, and so on. Our acts of love will include a touch of
paradise on earth.
With the assistance of affection and brotherhood, we can make a decent bonding
and a great understanding among the individuals in our society.
",2
47,"Love is effortless. Love is not just a emotion, it is who we are. Every other emotion is a form of 
love. Hate is distorted love jealousy is scarcity of love and joy is a feeling of being loved. Love 
gives a new light to life which makes everything enjoyable. Love is simply magic which is the 
greatest form of strength. It gives clarity in life. We can figure out what our priority is and what 
we want to achieve . It gives us precious memories to cherish forever. 
",2
48,"Love is a complex and multifaceted emotion that can be difficult to define. It is often described
as a feeling of strong affection or deep attachment towards someone or something. Love can
take many forms, such as romantic love between two people, love between family members and
close friends, or the love of a hobby or interest.
Love is often associated with positive feelings such as happiness, joy, and contentment. It can
also involve caring for and supporting someone or something, and being willing to make
sacrifices for their well-being.
Love is a subjective experience and can be difficult to define in concrete terms. It is often said
that ""love is in the eye of the beholder,"" meaning that everyone's experience of love is unique
and personal. Some people may define love as a feeling of intense attraction and passion, while
others may see it as a deep sense of connection and commitment. Ultimately, the definition of
love may vary depending on the individual and the context in which it is experienced.
",2
49,"About Love 
Love is an emotion that keeps people bonded and committed to one another. Everywhere in this you 
can find love. From nature to its children's love can be found and expressed in many ways. Parents to 
their children, from family to their young once. Now a days this so-called young generation has 
changed the actual meaning of the word. With context to Hindu mythology love is all about providing 
happiness to other by keeping owns expectation low. If you want other to love you, you must also 
accept the consequences. 
",2
50,"About Love
A powerful argument! You are amazing at this. I commend you for your quick thinking. A
splendid job! I commend you for your thorough work. I like how you've tackled this
assignment. Appreciated I like the way you're working. Astounding I like the way you've
handled this. Awesome. I like the way you settle down to work. Beautiful I like your style.
Bravo I love your care. Brilliant I noticed that. Clear, concise, and complete! I see much
improvement in your. Dazzling Impressive Dedicated effort It's a pleasure to teach you
when you work. Exactly right! Keep it up. Excellent Keep up the good work. Exceptional
Magnificent Exciting Majestic thoughts Exemplary Marvelous Exhilarating Meritorious
Extraordinary Much better Fabolous My goodness, how impressive! Fantastic Nice going
Favorable Noble Fine Noteworthy
",2
51,"About Love
Spectacular This shows you've really been thinking. Splendid Thorough Stupendous
Thoughtful! Successful effort Tiptop Super Top-notch Super job/Super work Top-notch
work!
",2
52,"About Love
Successful effort Tiptop Super Top-notch Super job/Super work Top-notch work! Splendid
Thorough Stupendous Thoughtful! Successful effort Tiptop Super Top-notch Super
job/Super work Top-notch work! Superb Very creative Superior work/Superior job Very
fine work
",2
53,"About Love
You did a great job on that project! I really appreciate your help and support .Your
kindness and generosity are truly inspiring.I am so grateful to have you in my life.Your
positive attitude always brightens my day.
I love spending time with you.You mean so much to me.
I am so grateful to have you in my life.
I appreciate your kind and thoughtful words.Your love and support mean the world to me.
",2
54,"About Love
I love you.You are my everything.I am so lucky to have you in my life.I cherish every
moment we spend together.I can't imagine my life without you.I am grateful for your love
and support.You make my heart skip a beat.I am yours forever.I am so thankful to have
you by my side.I love you more and more every day.
",2
55,"About Love
Greatness is a term that is often used to describe people, things, or accomplishments that are considered
exceptional or outstanding. Greatness can involve a variety of qualities, such as talent, excellence,
achievement, or virtue. It can also involve a sense of importance or significance, either to a particular
group or to society as a whole.
Goodness, on the other hand, is often used to describe moral or ethical qualities. It is a term that is used to
describe actions, behaviors, or intentions that are seen as virtuous or benevolent. Goodness can involve
qualities such as kindness, compassion, honesty, and fairness.
Greatness and goodness are not always the same thing. It is possible for someone or something to be great
without being necessarily good, and vice versa. For example, a person who is highly skilled or
accomplished in a particular area may be considered great, but if their actions or behaviors are not ethical
or virtuous, they may not be considered good. On the other hand, a person who is kind, compassionate,
and fair may be considered good, even if they are not particularly accomplished or skilled in a particular
area.
It is generally considered more important to be good rather than great. While achieving greatness in a
particular field or area may be a worthy goal, it is more important to act in a way that is ethical,
compassionate, and fair. By striving to be good, we can contribute to the well-being and happiness of
ourselves and others, and create a more positive and healthy society.
",2
56,"About Love
The idea of doing something good for the society is simply splendid and brilliant. Thats
how brilliant people live their daily life, Being Splendid in small things and doing good in
small acts of kindness and this kindness is nothing else but reflection of what their beautiful
upbringing was all about.We should understand that beautiful people on the outside can
have something to hide but beautiful people on the inside are always good despite the
condition they will always be splendid, Brilliant and downright beautiful to me.
",2
57,"In this modern world, for me love is very precious and most valuable feeling. Love is freedom, 
Love is sacrifice. Love has another meaning for me i.e. to give but not to expect anything in return. 
When you know how to give, you know how to love. Mother is best example for this, she wants 
nothing but only know how to love and sacrifice for her children. Pure love gives strength, amazing 
feeling and gives different eye to see the world. Pure love always guides to correct direction. Love 
is very deep and cannot be explained in some sentences. Love is amazing feeling which can be felt 
and can change any person. Pure love never has jealousy cause, one is happy in loved one’s 
happiness and respects their feelings. Pure love should be preserved, always respected, uplifted 
and shared. Sharing and spreading love increases love. Love is expressed through action and is not 
limited only in words. With correct intension, selfless love is best feeling to explore and 
experience. Love is the only feeling which is holding each and every relation existing. Love is 
positivity which can fill heart with joy and make burden heart light. Sleeping in mother’s lap 
removes all the burden in the heart like a magic. Love is wonderful magic and reason behind the 
happiness. 
",2
58,"Love
Love for me is the inner connection between two people's. The deep feeling
of affection that attracts,attach with full heart.My love for you in
unexplainable and more than infinite. Love is the spark that both can feel.
Love is the language itself which need not to be described. The
understanding without telling a word is the love for me. Sharing each and
everything without a lie and fear is love. These words are not enough to
explain love for you. This attachment of soul which is immense.The power
of love can create miracles. Love is unconditional and selfless. Love knows
no boundaries.Love makes you to do the best things for your loved ones to
make them feel happy & proud about themselves. When you love someone
you accept their weakness too and love them for whatever they are. Love has
no specific meaning. Love is the most important aspect of an individual’s life.
Love also carries harsh feelings sometimes but still it is considered as one of
the best feeling in the world.
",2
59," 
 
 
 
 
About Love 
'Love is not jealousy, ambition, fulfilment or becoming; love is not desire or pleasure' ‘When you love, 
everything will come right. If you want to find out who is always looking out for you, take some time to 
find out. You are challenged to think one week about your life and future. Start today! Think. Life. 
Meaning. Highlights: Donation Option Available, Multiple Payment Options Available. Love is an emotion 
that keeps people bonded and committed to one another. Love is considered to be both positive and 
negative, with its virtue representing human kindness, compassion, and affection, as ""the unselfish loyal 
and benevolent concern for the good of another"" and its vice representing human moral flaw, akin to 
vanity, selfishness, amour-propre, and egotism, as potentially leading people into a type of mania, 
obsessiveness or codependency. It may also describe compassionate and affectionate actions towards 
other humans, one's self, or animals. In its various forms, love acts as a major facilitator of interpersonal 
relationships and, owing to its central psychological importance, is one of the most common themes in 
the creative arts. Love has been postulated to be a function that keeps human beings together against 
menaces and to facilitate the continuation of the species. Being in love makes you feel inspired. It gives 
you a can-do attitude that you can approach anything, anywhere, anytime. Being in love gives you 
motivation. Your attitude is optimistic and always positive. 
",2
